{
  "$schema": "http://json-schema.org/draft-04/schema#",
  "definitions": {},
  "properties": {
    "EventsApi": {
      "properties": {
        "BaseUrl": {
          "minLength": 1,
          "type": "string",
          "environmentVariable": "EventsApiBaseUrl"
        },
        "ClientToken": {
          "minLength": 1,
          "type": "string",
          "environmentVariable": "EventsApiClientToken"
        }
      },
      "additionalProperties": false,
      "required": [
        "BaseUrl",
        "ClientToken"
      ],
      "type": "object"
    },
    "PaymentsEnabled": {
      "type": "boolean",
      "environmentVariable": "PaymentsEnabled"
    },
    "PaymentsBool": {
      "type": "boolean",
      "environmentVariable": "PaymentsBool"
    },
    "PaymentsInt": {
      "type": "integer",
      "environmentVariable": "PaymentsInt"
    },
    "PaymentsNumber": {
      "type": "number",
      "environmentVariable": "PaymentsNumber"
    },
    "PaymentsArray": {
      "type": "array",
      "environmentVariable": "PaymentsArray"
    },
    "PaymentsString": {
      "type": "string",
      "environmentVariable": "PaymentsString"
    },
    "PaymentsDefaultValue": {
      "type": "string",
      "default": "default-value",
      "environmentVariable": "PaymentsDefaultValue"
    },
    "PaymentsBlankDefault": {
      "type": "string",
      "default": ""
    },
    "PaymentsObjectArray": {
      "type": "array",
      "items": {
        "type": "object",
        "properties": {
          "Enabled": {
            "type": "boolean"
          },
          "aString": {
            "type": "string"
          }
        },
        "additionalProperties": false,
        "required": [
          "Enabled",
          "aString"
        ]
      },
      "minItems": 0,
      "environmentVariable": "PaymentsObjectArray"
    },
    "GoogleHeaderUrl": {
      "type": "string",
      "environmentVariable": "GoogleHeaderUrl"
    }
  },
  "additionalProperties": false,
  "required": [
    "EventsApi",
    "PaymentsEnabled",
    "PaymentsInt"
  ],
  "type": "object"
}
