{
  "EventsApi": {
    "BaseUrl": "https://events.test.com",
    "ClientToken": "xxxxxxxxxxlksmdflkm3lkmlkm"
  },
  "PaymentsEnabled": true,
  "PaymentsInt": 1,
  "PaymentsNumber": 1.0,
  "PaymentsArray": [
    "one",
    "two",
    "three"
  ],
  "PaymentsBlankDefault": "",
  "PaymentsObjectArray": [
    {
      "Enabled": true,
      "aString": "string"
    }
  ],
  "GoogleHeaderUrl": "'https://www.googletagmanager.com/gtm.js?id='wrappedinquotes'&gtm_auth=someauth&gtm_preview=env-7&gtm_cookies_win=x'"
}
